"","school","survey_comments"
"100","St Stephens Academy – Beaverton","During the 5 years our school has had ""Outdoor School"", we have sent our 7th & 8th grade students to OMSI--Hancock Field Station--twice, Camp Gray--once (this spring), and have camped at South Beach State Park and taken our students for classes and activities at the Hatfield Marine Science Center.

As part of our 7th & 8th grade science curricula and goals, hands-on and real-life exposure to the natural world are an essential part of educational programs.  Our students and all students need exposure to being out in nature and not just reading about it in the classroom. We were very pleased with the opening of Camp Gray, since the ""camping"" at South Beach State Park was quite an adventure for the staff to pull off every other year when we not going to the Hancock Field Station.  Our only regret is that the programs at the Hatfield Marine Science Center were more academic that the one's at Camp Gray.  Also, many of the choices at Camp Gray were the same as the Hancock Field Station, so we were a little limited as to what our students would do.

Overall, it is a wonderful opportunity and experience for students to go to camp and be in the environment that they are learning about."
"101","St Therese School – Portland","We love it and think it is vital to all our students!"
"102","St Thomas Academy – Redmond","We are currently an ONREP school and we are private so the 1 week outdoor school doesn't apply to us.  We have many experiential lessons and field trips that are learned outside the classroom because of ONREP."
"103","Stayton Middle School – Stayton","I am excited to be a part of this process.  Outdoor School has been my passion since it started in 1988 and I was a councilor.  Please let me know of ways I can help in the process."
"104","Stearns Elementary School – Klamath Falls","I am wondering if OSU extension will have their program set up for outdoor school in the 2017-2018 school year? I am concerned that they may benefit financially from delaying the program launch and distribution of funds. This seems it may provide opportunity for conflict of interest."
"105","Stella Mayfield Elementary School – Elgin","How do we get some of that funding?"
"106","Stephens Middle School – Salem","I would LOVE to send our students to outdoor school - in fact, I am passionate about this issue.  However, my school is enormous (1120 students) and I would need help understanding how I could get students (even just one grade level) to outdoor school."
"107","Stoller Middle School – Portland","Did you get the fax I sent for Stoller to do Outdoor school 2017-18."
"108","Summit Learning Charter School – Eagle Creek","Give a call.  Let's talk and see whether Outdoor school is a fit for our students"
"109","Sunridge Middle School – Pendleton","We have an awesome program in a very supportive community."
"110","Sunstone Montessori School – Portland","we love it!"
"111","Sweet Home Charter School – Sweet Home","Outdoor School is a wonderful experience for students and staff!"
"112","Talent Elementary School – Talent","I am not sure if I responded correctly to all the questions.  My teachers work with Southern Oregon University Environmental Studies Students who provide the outdoor experience.  The number of years may be greater than ten, I have only been here for 5 and I know they have been doing outdoor school much longer than that."
"113","Terrebonne Community School – Terrebonne","I think this is important for many reasons for kids to take part in this experience.  I am disappointed that Measure 99 was billed as a way to pay for this, however it was an unfunded mandate and there is still no substantive way to pay for it yet without taking from other programs.  Where then does the money come from?  I work in a high poverty school and we charge 100 dollars for those that can pay.  In my current format it is cost prohibitive and there is potential from year to year we cannot cover the cost of the program."
"114","The International School – Portland","I am new to the Portland area and this is my first year at The International School."
"115","The Ivy Montessori Public Charter Elementary School – Portland","We do arrange for overnight experiences for our students, but I don't believe these  technically qualify as ""capital O, capital S""  Outdoor School . I look forward to learning more."
"116","Tumalo Community School – Bend","Not at this time."
"117","Umpqua Valley Christian School – Roseburg","We are a Christian school and therefore teach science for a Christian perspective.  That may or may not be compatible with the State of Oregon's focus in outdoor education.  In a previous school, in California, we utilized a Christian outdoor education program."
"118","Valor Middle School – Woodburn","This is really needed in Woodburn to get our students out in nature and learn life long skills."
"119","Vern Patrick Elementary School – Redmond","With the state law not allowing schools to request that parents pay for field trips, I am concerned that we will not be able to attend outdoor school in the future. We have always asked families to contribute a portion of the cost so we can go. We do not have funds to do it otherwise and we were informed that measure 99 funds will not be available until after 2018"
"120","Village School – Eugene","We have been doing a 2 day program at Opal Creek with our 5th Graders for at least 7 years. A 5 day program may be challenging to fit within our curriculum."
"121","Vineyard Christian School – Grants Pass","no"
"122","Wallowa Elementary School – Wallowa","We do a outdoor experience that student are bussed daily to a location and learn science topics.  This is put on by our Wallowa Resource group and is only offered to 4th and 5th grade.  It is only a week long."
"123","West Tualatin View Elementary School – Portland","This is our last year to participate in ODS.  The feeder middle school now attends and parents are not pleased about the cost of students participating twice in less than 6 months."
"124","West Union Elementary School – Hillsboro","Our kids enjoy it and it is a great opportunity! We glad that the state is able to provide this experience!"
"125","Willowcreek Elementary School – Vale","We need to make outdoor school an option for the kids in Eastern Oregon!"
"126","Wilson Elementary School – Corvallis","Our program for many years was run by teachers 5 days at Camp Kiwanalong, but it was a challenge to plan meals, hire lifeguards, coordinate curriculum, etc... working with OMSI will be more sustainable, but I would like to increase to the 4 or 5 day program. It was more inclusive this year with going to Newport which is closer to Corvallis.  Example, some kids came for the day. The principal (me) was able to join for an evening. This was difficult when up in Astoria, although the museums were great!"
"127","Woodburn Arthur Academy – Woodburn","No, but I was impressed that the survey did only take 5 or less minutes.  Usually they say only 5 minutes but the next time you look at your watch 15 to 20 minutes have passed."
"128","Woodland Elementary School – Fairview","Thank you for creating a wonderful opportunity for kids!"
"129","Yamhill Carlton Intermediate School – Yamhill","I think it's great.  I wish they had it when I went to school."
