Liberty Elementary School – Albany,Liberty Elementary School,Greater Albany Public SD 8J,Linn Benton Lincoln ESD,Memorial Middle School – Albany,2345 Liberty St SW,Albany,OR,97321,Linn,541-967-4578,K,5,Elementary,Public,Regular School,641,Principal,Rich Sipe,rich.sipe@albany.k12.or.us,,,No,,,,,,,,,,,,No,,,,NOT AT ALL interested,Not sure at this point,SOMEWHAT FAMILIAR with Measure 99,A BIT FAMILIAR with the role OSU Extension plays,Our school is grades K-5.  I believe the district plan is to look at Outdoor School as a 6th grade experience.,,355,348,184,52.9%,164,47.1%,2,0.6%,8,2.3%,1,0.3%,1,0.3%,23,6.6%,277,79.6%,36,10.3%,56,48,56,60,63,65,,,,,,,,false,Memorial Middle School – Albany,-123.1182308,44.6191467,Memorial Middle School,
Liberty Elementary School – Salem,Liberty Elementary School,Salem-Keizer SD 24J,Willamette ESD,Crossler Middle School – Salem,4871 Liberty Rd S,Salem,OR,97306,Marion,503-399-3165,K,5,Elementary,Public,Regular School,749,Principal,Lizi Aguilar-Nelson,aguilar-nelson_lizi@salkeiz.k12.or.us,,,No,,,,,,,,,,,,,,,,,,,,,,372,386,198,51.3%,188,48.7%,4,1%,2,0.5%,13,3.4%,6,1.6%,52,13.5%,279,72.3%,30,7.8%,52,51,54,68,84,77,,,,,,,,false,Crossler Middle School – Salem,-123.0615322,44.8869293,Crossler Middle School,
Life Christian School – Aloha,Life Christian School,,,,5585 SW 209th Ave,Aloha,OR,97007,Washington,503-259-1329,K,12,Other,Private,Regular School,,,,lcs@lcslions.org,,,Yes,28,6th grade,Twin Rocks Friends Conference,3,2,Twin Rocks Friends Conference,,We develop with our provider as well as ourself,,,,,,,,,,,,,,,,,,,,,,,,,,,,,,,,,,,,,,,,,,,,,,,false,,-122.8950677,45.4797834,,
Life Lutheran School – Eugene,Life Lutheran School,,,,710 E 17th Ave,Eugene,OR,97401,Lane,541-342-5433,PK,8,Other,Private,Regular School,,,,office@lifeschool.us,,,,,,,,,,,,,,,,,,,,,,,,,,,,,,,,,,,,,,,,,,,,,,,,,,,,,,,,,,false,,-123.0816082,44.0407378,,
Lighthouse Charter School – Coos Bay,Lighthouse Charter School,Coos Bay SD 9,South Coast ESD,,62858 HWY 101,Coos Bay,OR,97420,Coos,541-751-1649,K,8,Other,Public,Charter School,3615,Director,Wade  Lester,lhlester@nbend.k12.or.us,Built outdoor classroom at school in past year. Email: hstorm@thelighthouseschool.org,,No,,,,,,,,,,,,,,,,,,,,,,,,,,,,,,,,,,,,,,,,,,,,,,,,,,,,,,,false,,-124.2003308,43.3540527,,
Lincoln City Seventh-Day Adventist School – Lincoln City,Lincoln City Seventh-Day Adventist School,,,,2126 NE Surf Ave,Lincoln City,OR,97367,Lincoln,541-994-5181,1,12,Other,Private,Regular School,,,,lcsdas@gmail.com,,,Yes,5,6th grade,Big Lake Youth Camp,4,3,Oregon Conference of Seventh-day Adventists,"Yet, but it DOES NOT CONNECT TO STATE STANDARDS",We use curriculum developed by an outside provider,"Program provider staff, Parent volunteers",We are ABLE TO MAKE SOME accommodations so our program is accessible for all students,4,,,,,,,NOT AT ALL FAMILIAR with Measure 99,NOT AT ALL FAMILIAR with the role OSU Extension plays,Unsure how many years our school has participated. It's been at least 4.,,,,,,,,,,,,,,,,,,,,,,,,,,,,,,,,,,,true,,-124.0018503,44.9800764,,
Lincoln Elementary School – Corvallis,Lincoln Elementary School,Corvallis SD 509J,Linn Benton Lincoln ESD,Linus Pauling Middle School – Corvallis,110 SE Alexander Ave,Corvallis,OR,97333,Benton,541-757-5955,K,5,Elementary,Public,Regular School,36,Principal,Aaron Hale,aaron.hale@corvallis.k12.or.us,,,Yes,42,5th grade,Coastal Discovery Center at Camp Gray,3,2,OMSI,"Yes, and it CONNECTS TO STATE STANDARDS",OMSI,"Program provider staff, Parent volunteers",,,,,,,,,,,,,367,360,171,47.5%,189,52.5%,1,0.3%,2,0.6%,,0%,6,1.7%,120,33.3%,212,58.9%,19,5.3%,67,56,66,61,65,45,,,,,,,,false,Linus Pauling Middle School – Corvallis,-123.2649396,44.5447155,Linus Pauling Middle School,
Lincoln Elementary School – Grants Pass,Lincoln Elementary School,Grants Pass SD 7,Southern Oregon ESD,North Middle School – Grants Pass,1132 NE 10th St,Grants Pass,OR,97526,Josephine,541-474-5770,K,5,Elementary,Public,Regular School,437,Principal,Missy Fitzsimmons,mfitzsimmons@grantspass.k12.or.us,,,Sister school did,,,,,,,,,,,,,,,,,,,,,,452,454,262,57.7%,192,42.3%,5,1.1%,14,3.1%,1,0.2%,1,0.2%,97,21.4%,310,68.3%,26,5.7%,68,74,77,78,81,76,,,,,,,,false,North Middle School – Grants Pass,-123.3135413,42.4499413,North Middle School,
Lincoln Elementary School – Woodburn,Lincoln Elementary School,Woodburn SD 103,Willamette ESD,French Prairie Middle School – Woodburn,1041 N Boones Ferry Rd,Woodburn,OR,97071,Marion,503-981-2825,K,5,Elementary,Public,Regular School,1267,Principal,Jennifer Caragol,jcaragol@woodburnsd.org,,,No,,,,,,,,,,,,,,,,,,,,,,784,796,425,53.4%,371,46.6%,1,0.1%,2,0.3%,3,0.4%,5,0.6%,676,84.9%,103,12.9%,6,0.8%,127,120,124,142,147,136,,,,,,,,false,French Prairie Middle School – Woodburn,-122.8598424,45.1514058,French Prairie Middle School,
Lincoln Middle School – Cottage Grove,Lincoln Middle School,South Lane SD 45J3,Lane ESD,"Bohemia Elementary School – Cottage Grove, Harrison Elementary School – Cottage Grove, Latham Elementary School – Cottage Grove",1565 S 4th St,Cottage Grove,OR,97424,Lane,541-942-3316,6,8,Middle,Public,Regular School,579,Principal,Jeremy Smith,jeremy.smith@slane.k12.or.us,,,No,,,,,,,,,,,,,,,,,,,,,,520,555,288,51.9%,267,48.1%,11,2%,6,1.1%,,0%,4,0.7%,66,11.9%,467,84.1%,1,0.2%,,,,,,,185,191,179,,,,,false,"Bohemia Elementary School – Cottage Grove, Harrison Elementary School – Cottage Grove, Latham Elementary School – Cottage Grove",-123.065079,43.7844774,,
Lincoln Middle School – Oakland,Lincoln Middle School,Oakland SD 1,Douglas ESD,,931 Old Town Lp,Oakland,OR,97462,Douglas,541-459-3407,5,8,Middle,Public,Regular School,266,Principal,Diana Sweeden,diana.sweeden@oakland.k12.or.us,,,No,,,,,,,,,,,,,,,,,,,,,,168,193,91,47.2%,102,52.8%,3,1.6%,,0%,,0%,,0%,14,7.3%,176,91.2%,,0%,,,,,,47,47,51,48,,,,,false,,-123.299088,43.43013,,
Lincoln Park Elementary School – Portland,Lincoln Park Elementary School,David Douglas SD 40,Multnomah ESD,Ron Russell Middle School – Portland,13200 SE Lincoln St,Portland,OR,97233,Multnomah,503-256-6504,K,5,Elementary,Public,Regular School,975,Principal,Rebecca Chase,rebecca_chase@ddouglas.k12.or.us,,,Sister school did,,,,,,,,,,,,,,,,,,,,,,632,644,351,54.5%,293,45.5%,2,0.3%,115,17.9%,20,3.1%,50,7.8%,197,30.6%,226,35.1%,34,5.3%,97,106,110,119,95,117,,,,,,,,false,Ron Russell Middle School – Portland,-122.5263255,45.5082866,Ron Russell Middle School,
Lincoln Savage Middle School – Grants Pass,Lincoln Savage Middle School,Three Rivers/Josephine County SD,Southern Oregon ESD,"Fruitdale Elementary School – Grants Pass, Madrona Elementary School – Grants Pass, Williams Elementary School – Williams",8551 NEw Hope Rd,Grants Pass,OR,97527,Josephine,541-862-2171,6,8,Middle,Public,Regular School,448,Principal,Mark Higgins,mark.higgins@threerivers.k12.or.us,,,No,,,,,,,,,,,,,,,,,,,,,,358,363,186,51.2%,177,48.8%,9,2.5%,3,0.8%,3,0.8%,1,0.3%,41,11.3%,286,78.8%,20,5.5%,,,,,,,126,123,114,,,,,false,"Fruitdale Elementary School – Grants Pass, Madrona Elementary School – Grants Pass, Williams Elementary School – Williams",-123.3349153,42.3483851,,
Lincoln Street Elementary School – Hillsboro,Lincoln Street Elementary School,Hillsboro SD 1J,Northwest Regional ESD,,801 N.E. Lincoln Street,Hillsboro,OR,97124,Washington,503-844-1160,K,6,Elementary,Public,Regular School,4642,Principal,Carmen Brodniak,brodniac@hsd.k12.or.us,,,Yes,81,6th grade,Trickle Creek,3,2,Northwest Regional ESD,"Yes, and it CONNECTS TO STATE STANDARDS",,,,,,,,,,,,,,,550,518,247,47.7%,271,52.3%,5,1%,3,0.6%,3,0.6%,7,1.4%,391,75.5%,102,19.7%,7,1.4%,73,67,63,78,75,80,82,,,,,,,true,,-122.9767641,45.5243548,Evergreen Jr High School,
Linus Pauling Middle School – Corvallis,Linus Pauling Middle School,Corvallis SD 509J,Linn Benton Lincoln ESD,"Adams Elementary School – Corvallis, Garfield Elementary School – Corvallis, Jefferson Elementary School – Corvallis, Lincoln Elementary School – Corvallis",1111 NW Cleveland Ave,Corvallis,OR,97330,Benton,541-757-5961,6,8,Middle,Public,Regular School,38,Principal,Alicia Ward Satey,alicia.ward-satey@corvallis.k12.or.us,,,,,,,,,,,,,,,,,,,,,,,,,698,729,398,54.6%,331,45.4%,6,0.8%,21,2.9%,3,0.4%,6,0.8%,181,24.8%,464,63.6%,48,6.6%,,,,,,,240,236,253,,,,,false,"Garfield Elementary School – Corvallis, Adams Elementary School – Corvallis, Jefferson Elementary School – Corvallis, Lincoln Elementary School – Corvallis",-123.2641508,44.5865602,,
Linwood Elementary School – Milwaukie,Linwood Elementary School,North Clackamas SD 12,Clackamas ESD,Rowe Middle School – Milwaukie,11909 SE Linwood Ave,Milwaukie,OR,97222,Clackamas,503-353-5460,K,5,Elementary,Public,Regular School,4765,Principal,Amy Busch,buscha@nclack.k12.or.us,,,Sister school did,,,,,,,,,,,,,,,,,,,,,,334,315,159,50.5%,156,49.5%,1,0.3%,10,3.2%,11,3.5%,16,5.1%,81,25.7%,174,55.2%,22,7%,55,46,51,64,54,45,,,,,,,,false,Rowe Middle School – Milwaukie,-122.6005071,45.4365174,Rowe Middle School,
Living Wisdom School – Beaverton,Living Wisdom School,,,,4855 SW Watson Ave,Beaverton,OR,97005,Washington,503-671-9112,PK,8,Other,Private,Regular School,,,,office@livingwisdomportland.org,,,,,,,,,,,,,,,,,,,,,,,,,,,,,,,,,,,,,,,,,,,,,,,,,,,,,,,,,,false,,-122.8068523,45.4847864,,
Livingstone Adventist Academy – Salem,Livingstone Adventist Academy,,,,5771 Fruitland Rd NE,Salem,OR,97317,Marion,503-363-9408,K,12,Other,Private,Regular School,,,,jreyes@laaonline.org,,,,,,,,,,,,,,,,,,,,,,,,,,,,,,,,,,,,,,,,,,,,,,,,,,,,,,,,,,false,,-122.9414483,44.9417492,,
Llewellyn Elementary School – Portland,Llewellyn Elementary School,Portland SD 1J,Multnomah ESD,Sellwood Middle School – Portland,6301 SE 14th Ave,Portland,OR,97202,Multnomah,503-916-6216,K,5,Elementary,Public,Regular School,872,Principal,Joseph Galati,jgalati@pps.net,,,Yes,100,5th grade,Coastal Discovery Center at Camp Gray,3,2,OMSI,"Yes, and it CONNECTS TO STATE STANDARDS",OMSI,"Program provider staff, Parent volunteers",,,,,,,,,,,,,535,517,273,52.8%,244,47.2%,2,0.4%,9,1.7%,5,1%,5,1%,28,5.4%,422,81.6%,46,8.9%,74,92,72,78,100,101,,,,,,,,false,Sellwood Middle School – Portland,-122.6522168,45.477166,Sellwood Middle School,
Logos Public Charter School – Medford,Logos Public Charter School,Medford SD 549C,Southern Oregon ESD,,400 Earhart,Medford,OR,97501,Jackson,541-842-3658,K,12,Other,Public,Charter School,4821,Director,Joseph VonDoloski,jvondo@logoscharter.com,,,No,,,,,,,,,,,,,,,,,,,,,,870,886,400,45.1%,486,54.9%,5,0.6%,8,0.9%,2,0.2%,5,0.6%,83,9.4%,755,85.2%,28,3.2%,53,80,58,70,74,55,56,58,61,77,73,84,87,false,,-122.8639946,42.3209032,,
London School – Cottage Grove,London School,South Lane SD 45J3,Lane ESD,,73288 London Rd,Cottage Grove,OR,97424,Lane,541-942-0183,K,8,Other,Public,Regular School,578,Principal,Bill Bechen,bill.bechen@slane.k12.or.us,,,Yes,45,5th grade,Grove Christian Camp,3,2,Umpqua National Forest,"Yes, and it CONNECTS TO STATE STANDARDS","School staff develop the curriculum, Forest Service","State agency or community resource experts (e.g. watershed council personnel or Fish & Wildlife staff), High school mentors",We are ABLE TO MAKE ALL NECESSARY accommodations so our program is accessible for all students,25,,,,,,,VERY FAMILIAR with Measure 99,NOT AT ALL FAMILIAR with the role OSU Extension plays,"I have been involved in Outdoor School for 14 years, and I absolutely love it! I believe it is very necessary for our students to experience this as I have seen first hand how this affects students in such a positive way.",,95,87,38,43.7%,49,56.3%,,0%,1,1.1%,1,1.1%,1,1.1%,10,11.5%,73,83.9%,1,1.1%,12,8,12,8,16,11,13,4,3,,,,,true,,-123.08446,43.6496629,,
Lone Pine Elementary School – Medford,Lone Pine Elementary School,Medford SD 549C,Southern Oregon ESD,Hedrick Middle School – Medford,3158 Lone Pine Rd,Medford,OR,97504,Jackson,541-842-3820,K,6,Elementary,Public,Regular School,414,Principal,Kristina Anderson,kristi.anderson@medford.k12.or.us,,,Sister school did,,,,,,,,,,,,,,,,,,,,,,595,606,302,49.8%,304,50.2%,8,1.3%,16,2.6%,3,0.5%,3,0.5%,90,14.9%,462,76.2%,24,4%,87,73,78,90,97,77,104,,,,,,,false,Hedrick Middle School – Medford,-122.8327806,42.3445894,Hedrick Middle School,
Long Creek School – Long Creek,Long Creek School,Long Creek SD 17,Grant ESD,,375 E Main,Long Creek,OR,97856,Grant,541-421-3896,PK,12,Other,Public,Regular School,3366,Principal,Del Dykstra,dykstrad@grantesd.k12.or.us,,,,,,,,,,,,,,,,,,,,,,,,,34,30,19,63.3%,11,36.7%,2,6.7%,4,13.3%,,0%,,0%,2,6.7%,18,60%,4,13.3%,1,,,,1,3,2,2,4,2,2,8,5,false,,-119.1008382,44.7137395,,
Lookingglass Elementary School – Roseburg,Lookingglass Elementary School,Winston-Dillard SD 116,Douglas ESD,,7421 Lookingglass Rd,Roseburg,OR,97470,Douglas,541-679-3006,K,6,Elementary,Public,Regular School,313,Principal,Oriole Inkster,inkstero@wdsd.org,,,Yes,25,5th grade,Hancock Field Station,5,4,OMSI,"Yes, and it CONNECTS TO STATE STANDARDS",We use curriculum developed by an outside provider,"Program provider staff, Parent volunteers",We are ABLE TO MAKE SOME accommodations so our program is accessible for all students,2,,,,,,,SOMEWHAT FAMILIAR with Measure 99,NOT AT ALL FAMILIAR with the role OSU Extension plays,Help in funding would be great. Our district does not contribute any funds for the program. Students and families do all of the fundraising to support their trip. $260 per student.,,158,191,105,55%,86,45%,3,1.6%,,0%,,0%,3,1.6%,8,4.2%,172,90.1%,5,2.6%,25,27,25,34,32,23,25,,,,,,,false,,-123.487233,43.176983,Winston Middle School,x
Lorna Byrne Middle School – Cave Junction,Lorna Byrne Middle School,Three Rivers/Josephine County SD,Southern Oregon ESD,,101 S Junction Ave,Cave Junction,OR,97523,Josephine,541-592-2163,5,8,Middle,Public,Regular School,449,Principal,Scott Polen,scott.polen@threerivers.k12.or.us,,,Yes,,6th grade,,,,,,,,,,,,,,,,,,,,317,299,150,50.2%,149,49.8%,13,4.3%,1,0.3%,,0%,3,1%,21,7%,243,81.3%,18,6%,,,,,,66,73,80,80,,,,,false,,-123.6439551,42.1663061,,
Lourdes School – Scio,Lourdes School,Scio SD 95,Linn Benton Lincoln ESD,,39059 Jordan Rd,Scio,OR,97374,Linn,503-394-3340,1,8,Other,Public,Charter School,2994,Principal,Linda Duman,lourdes@smt-net.com,"Secretary said ""we live in the outdoors so we don't do Outdoor School""",,No,,,,,,,,,,,,,,,,,,,,,,48,49,24,49%,25,51%,,0%,,0%,,0%,,0%,3,6.1%,45,91.8%,1,2%,,5,6,9,9,3,7,5,5,,,,,false,,-122.6914384,44.7165568,,
Lowrie Primary School – Wilsonville,Lowrie Primary School,West Linn-Wilsonville SD 3J,Clackamas ESD,Inza R Wood Middle School – Wilsonville,28995 SW Brown Rd,Wilsonville,OR,97070,Clackamas,503-673-7700,PK,5,Elementary,Public,Regular School,5056,Principal,Patrick Meigs,meigsp@wlwv.k12.or.us,,,Sister school did,,,,,,,,,,,,,,,,,,,,,,602,571,287,50.3%,284,49.7%,,0%,30,5.3%,3,0.5%,5,0.9%,144,25.2%,344,60.2%,45,7.9%,85,100,91,103,110,82,,,,,,,,false,Inza R Wood Middle School – Wilsonville,-122.7869432,45.3101372,Inza R Wood Middle School,
Luckiamute Valley Charter School – Monmouth,Luckiamute Valley Charter School,Dallas SD 2,Willamette ESD,,12975 Kings Valley Hwy,Monmouth,OR,97361,Polk,503-838-1933,K,8,Middle,Public,Charter School,3461,Director,Steven Diehl,,,,Yes,18,6th grade,Camp Tapawingo,3,2,Perrydale Middle School,"Yet, but it DOES NOT CONNECT TO STATE STANDARDS","School staff develop the curriculum, We use curriculum developed by an outside provider","Program provider staff, State agency or community resource experts (e.g. watershed council personnel or Fish & Wildlife staff), High school mentors",We are ABLE TO MAKE ALL NECESSARY accommodations so our program is accessible for all students,4,,,,,,,A BIT FAMILIAR with Measure 99,SOMEWHAT FAMILIAR with the role OSU Extension plays,As far as I know our school has participate in Outdoor School for the last 4 years. It may have been longer.,,194,196,91,46.4%,105,53.6%,5,2.6%,,0%,2,1%,,0%,14,7.1%,158,80.6%,17,8.7%,20,24,26,23,24,25,18,20,16,,,,,true,,-123.4465524,44.7453094,,
Lundy Elementary School – Lowell,Lundy Elementary School,Lowell SD 71,Lane ESD,,45 S Moss St,Lowell,OR,97452,Lane,541-937-2105,K,6,Elementary,Public,Regular School,598,Principal,Johnie Matthews,jmatthews@lowell.k12.or.us,,,,,,,,,,,,,,,,,,,,,,,,,122,146,66,45.2%,80,54.8%,1,0.7%,,0%,,0%,3,2.1%,17,11.6%,105,71.9%,20,13.7%,18,24,18,20,27,22,17,,,,,,,false,,-122.784531,43.917586,Lowell Junior/Senior High School,
Lynch Meadows Elementary School – Portland,Lynch Meadows Elementary School,Centennial SD 28J,Multnomah ESD,,18009 SE Brooklyn St,Portland,OR,97236,Multnomah,503-762-3208,K,6,Elementary,Public,Regular School,959,Principal,Karen Weinert,Karen_weinert@csd28j.org,,,Yes,62,5th grade,Mazama Mountain Science School,3,2,Mazamas,"Yes, and it CONNECTS TO STATE STANDARDS",Mazamas,MESD staff,,,,,,,,,,,,,507,436,215,49.3%,221,50.7%,1,0.2%,52,11.9%,20,4.6%,16,3.7%,150,34.4%,173,39.7%,24,5.5%,49,60,55,76,68,59,69,,,,,,,false,,-122.4776367,45.5017218,Centennial Middle School,
Lynch View Elementary School – Portland,Lynch View Elementary School,Centennial SD 28J,Multnomah ESD,,1546 SE 169th Pl,Portland,OR,97233,Multnomah,503-762-3203,K,6,Elementary,Public,Regular School,964,Principal,Jim Mangan,jim_mangan@centennial.k12.or.us,,,Yes,69,5th grade,Mazama Mountain Science School,3,2,Mazamas,"Yes, and it CONNECTS TO STATE STANDARDS",Mazamas,MESD staff,,,,,,,,,,,,,528,507,243,47.9%,264,52.1%,,0%,55,10.8%,15,3%,34,6.7%,162,32%,205,40.4%,36,7.1%,65,69,88,70,74,75,66,,,,,,,false,,-122.4881626,45.5113142,Centennial Middle School,
Lynch Wood Elementary School – Portland,Lynch Wood Elementary School,Centennial SD 28J,Multnomah ESD,,3615 SE 174th St,Portland,OR,97236,Multnomah,503-762-3204,K,6,Elementary,Public,Regular School,965,Principal,Marin Miller,marin_miller@csd28j.org,,,Yes,62,5th grade,Mazama Mountain Science School,3,2,Mazamas,"Yes, and it CONNECTS TO STATE STANDARDS",Mazamas,MESD staff,,,,,,,,,,,,,515,505,255,50.5%,250,49.5%,4,0.8%,85,16.8%,7,1.4%,41,8.1%,148,29.3%,196,38.8%,24,4.8%,77,80,66,77,69,65,71,,,,,,,false,,-122.4857925,45.4963538,Centennial Middle School,
M A Lynch Elementary School – Redmond,M A Lynch Elementary School,Redmond SD 2J,High Desert ESD,Elton Gregory Middle School – Redmond,1314 SW Kalama Ave,Redmond,OR,97756,Deschutes,541-923-4876,1,5,Elementary,Public,Regular School,259,Principal,Rayna Nordstrom,rayna.nordstrom@redmondschools.org,,,Yes,73,5th grade,Camp Tamarack,3,2,Camp Tamarack,"Yes, and it CONNECTS TO STATE STANDARDS",We use curriculum developed by an outside provider,Program provider staff,,,,,,,,,,,,,,,,,173,46.4%,4,1.1%,1,0.3%,,0%,1,0.3%,108,29%,241,64.6%,18,4.8%,,74,86,65,65,83,,,,,,,,false,Elton Gregory Middle School – Redmond,-121.182416,44.26609,Elton Gregory Middle School,
Ma'Ayan Ha Torah Day School – Portland,Ma'Ayan Ha Torah Day School,,,,PO Box 19452,Portland,OR,97280,Multnomah,503-245-5568,PK,8,Other,Private,Regular School,,,,info@maayanpdx.org,,,No,,,,,,,,,,,,No,,,,A BIT interested,2017/2018 school year,NOT AT ALL FAMILIAR with Measure 99,NOT AT ALL FAMILIAR with the role OSU Extension plays,,,,,,,,,,,,,,,,,,,,,,,,,,,,,,,,,,,,false,,-122.72,45.47,,
Mabel Rush Elementary School – Newberg,Mabel Rush Elementary School,Newberg SD 29J,Willamette ESD,Mountain View Middle School – Newberg,1441 Deborah Rd,Newberg,OR,97132,Yamhill,503-554-4450,K,5,Elementary,Public,Regular School,1219,Principal,Lisa Callahan,callahanl@newberg.k12.or.us,,,Yes,93,5th grade,Twin Rocks Friends Conference,3,2,Twin Rocks Friends Conference,"Yes, and it CONNECTS TO STATE STANDARDS",It's a combo between our school and organizations we're working with,"Program provider staff, Parent volunteers",We are ABLE TO MAKE ALL NECESSARY accommodations so our program is accessible for all students,20,,,,,,,A BIT FAMILIAR with Measure 99,SOMEWHAT FAMILIAR with the role OSU Extension plays,"This is a great program and needs to be funded at a level that supports all students in attending.  Three days is enough though.  One whole week would be too much to ask of parent volunteers and teachers who would have to be away from their families, jobs, etc.",,519,520,275,52.9%,245,47.1%,4,0.8%,9,1.7%,,0%,5,1%,108,20.8%,364,70%,30,5.8%,82,75,74,84,111,94,,,,,,,,false,Mountain View Middle School – Newberg,-122.9508378,45.3107581,Mountain View Middle School,
Madras Primary School – Madras,Madras Primary School,Jefferson County SD 509J,Jefferson ESD,,215 SE 10th St,Madras,OR,97741,Jefferson,541-475-3520,K,5,Elementary,Public,Regular School,430,Principal,Deborah Hunt,dhunt@509j.net,,,,,,,,,,,,,,,,,,,,,,,,,368,408,211,51.7%,197,48.3%,37,9.1%,2,0.5%,,0%,1,0.2%,163,40%,192,47.1%,13,3.2%,63,68,78,64,58,77,,,,,,,,false,,-121.123527,44.6329468,,
Madrona Elementary School – Grants Pass,Madrona Elementary School,Three Rivers/Josephine County SD,Southern Oregon ESD,Lincoln Savage Middle School – Grants Pass,520 Detrick Dr,Grants Pass,OR,97527,Josephine,541-476-6624,K,5,Elementary,Public,Regular School,450,Principal,Miranda Carpenter,miranda.carpenter@threerivers.k12.or.us,,,Yes,55,4th grade,,1,0,Siskiyou Field Institute,"Yes, and it CONNECTS TO STATE STANDARDS",,,,,,,,,,,SOMEWHAT FAMILIAR with Measure 99,SOMEWHAT FAMILIAR with the role OSU Extension plays,,,342,376,192,51.1%,184,48.9%,4,1.1%,3,0.8%,2,0.5%,1,0.3%,37,9.8%,321,85.4%,8,2.1%,68,42,69,74,60,63,,,,,,,,true,Lincoln Savage Middle School – Grants Pass,-123.3631043,42.3623902,Lincoln Savage Middle School,
Madrone Trail Public Charter School – Medford,Madrone Trail Public Charter School,Medford SD 549C,Southern Oregon ESD,,3070 Ross Ln,Medford,OR,97502,Jackson,541-842-3657,K,8,Other,Public,Regular School,4593,Principal,"Karen Bailey, Joe Frodsham","Karen.Bailey@medford.k12.or.us, joe.frodsham@medford.k12.or.us",,,,,,,,,,,,,,,,,,,,,,,,,231,236,104,44.1%,132,55.9%,,0%,3,1.3%,,0%,1,0.4%,20,8.5%,196,83.1%,16,6.8%,20,25,25,26,26,25,25,43,21,,,,,false,,-122.945151,42.346629,,
Maimonides Jewish Day School – Portland,Maimonides Jewish Day School,,,,6612 SW Capitol Hwy,Portland,OR,97239,Multnomah,503-977-7850,PK,5,Elementary,Private,Regular School,,,,RWilhelm@PortlandJewishSchool.com,,,,,,,,,,,,,,,,,,,,,,,,,,,,,,,,,,,,,,,,,,,,,,,,,,,,,,,,,,false,,-122.7026709,45.4757303,,
Malabon Elementary School – Eugene,Malabon Elementary School,Bethel SD 52,Lane ESD,Cascade Middle School – Eugene,1380 Taney St,Eugene,OR,97402,Lane,541-461-6421,K,5,Elementary,Public,Regular School,586,Principal,Maureen Spence,maureen.spence@bethel.k12.or.us,,,No,,,,,,,,,,,,,,,,,,,,,,402,451,229,50.8%,222,49.2%,5,1.1%,4,0.9%,3,0.7%,4,0.9%,100,22.2%,305,67.6%,30,6.7%,76,67,79,80,77,72,,,,,,,,false,Cascade Middle School – Eugene,-123.161169,44.0768265,Cascade Middle School,
Malin Elementary School – Malin,Malin Elementary School,Klamath County SD,Southern Oregon ESD,,2153 Third St,Malin,OR,97632,Klamath,541-723-2261,K,6,Elementary,Public,Regular School,475,Principal,Larita Ongman,ongmanl@kcsd.k12.or.us,,,Yes,40,"5th grade, 6th grade",Coastal Discovery Center at Camp Gray,3,2,OMSI,"Yet, but it DOES NOT CONNECT TO STATE STANDARDS",We use curriculum developed by an outside provider,"Program provider staff, Parent volunteers",We are ABLE TO MAKE ALL NECESSARY accommodations so our program is accessible for all students,1,,,,,,,SOMEWHAT FAMILIAR with Measure 99,A BIT FAMILIAR with the role OSU Extension plays,I want to be able to take our students to any outdoor school we choose.,,134,136,76,55.9%,60,44.1%,4,2.9%,,0%,,0%,,0%,81,59.6%,51,37.5%,,0%,18,20,18,19,20,19,22,,,,,,,true,,-121.4111123,42.010226,Lost River High School,
Manzanita Elementary School – Grants Pass,Manzanita Elementary School,Three Rivers/Josephine County SD,Southern Oregon ESD,Fleming Middle School – Grants Pass,310 San Francisco St,Grants Pass,OR,97526,Josephine,541-479-6433,K,5,Elementary,Public,Regular School,451,Principal,Renee Hults,renee.hults@threerivers.k12.or.us,,,Sister school did,,,,,,,,,,,,,,,,,,,,,,417,406,204,50.2%,202,49.8%,6,1.5%,2,0.5%,2,0.5%,1,0.2%,24,5.9%,343,84.5%,28,6.9%,59,65,52,54,94,82,,,,,,,,false,Fleming Middle School – Grants Pass,-123.3714919,42.5066092,Fleming Middle School,
Maple Elementary School – Springfield,Maple Elementary School,Springfield SD 19,Lane ESD,"Briggs Middle School – Springfield, Hamlin Middle School – Springfield",2109  J  St,Springfield,OR,97477,Lane,541-744-6395,K,5,Elementary,Public,Regular School,550,Principal,Sheila Minney,sheila.minney@springfield.k12.or.us,,,No,,,,,,,,,,,,,,,,,,,,,,347,372,189,50.8%,183,49.2%,4,1.1%,3,0.8%,4,1.1%,4,1.1%,95,25.5%,235,63.2%,27,7.3%,73,63,61,62,52,61,,,,,,,,false,"Briggs Middle School – Springfield, Hamlin Middle School – Springfield",-122.9922053,44.0544447,Briggs Middle School,
Mapleton Elementary School – Mapleton,Mapleton Elementary School,Mapleton SD 32,Lane ESD,,10870 E Mapleton Rd,Mapleton,OR,97453,Lane,541-268-4471,K,6,Elementary,Public,Regular School,568,Principal,Jodi O'Mara,jomara@mapleton.k12.or.us,,,,,,,,,,,,,,,,,,,,,,,,,78,74,30,40.5%,44,59.5%,,0%,,0%,,0%,,0%,5,6.8%,61,82.4%,8,10.8%,10,9,15,6,13,11,10,,,,,,,false,,-123.8659914,44.0415836,Mapleton Jr/Sr High School,
Maplewood Elementary School – Portland,Maplewood Elementary School,Portland SD 1J,Multnomah ESD,Jackson Middle School – Portland,7452 SW 52nd Ave,Portland,OR,97219,Multnomah,503-916-6308,K,5,Elementary,Public,Regular School,873,Principal,Karen Bailey,jbailey2@pps.net,,,Sister school did,,,,,,,,,,,,,,,,,,,,,,359,384,212,55.2%,172,44.8%,1,0.3%,6,1.6%,2,0.5%,6,1.6%,27,7%,301,78.4%,41,10.7%,70,74,61,49,66,64,,,,,,,,false,Jackson Middle School – Portland,-122.7300118,45.4708977,Jackson Middle School,
