Eddyville Charter School – Eddyville,Eddyville Charter School,Lincoln County SD,Linn Benton Lincoln ESD,,1 Eddyville School Rd,Eddyville,OR,97343,Lincoln,541-875-2942,K,12,Other,Public,Charter School,3361,Superintendent/Principal,Jennifer Johnson,jennifer.johnson@lincoln.k12.or.us,,,Yes,18,5th grade,Hancock Field Station,3,2,OMSI,"Yes, and it CONNECTS TO STATE STANDARDS",OMSI,"Program provider staff, Parent volunteers",,,,,,,,,,,,,223,207,97,46.9%,110,53.1%,11,5.3%,,0%,,0%,,0%,21,10.1%,161,77.8%,14,6.8%,16,17,14,25,22,16,20,13,10,17,13,10,14,false,,-123.7782132,44.633966,,
Edgewood Community Elementary School – Eugene,Edgewood Community Elementary School,Eugene SD 4J,Lane ESD,Spencer Butte Middle School – Eugene,577 E 46th Ave,Eugene,OR,97405,Lane,541-790-8700,K,5,Elementary,Public,Regular School,1774,Principal,Larry Williams,williams_l@4j.lane.edu,,,Yes,72,5th grade,Camp Westwind,4,3,Northwest Regional ESD,"Yes, and it CONNECTS TO STATE STANDARDS",We use curriculum developed by an outside provider,"High school mentors, Special Education Teachers and Administration",We are ABLE TO MAKE ALL NECESSARY accommodations so our program is accessible for all students,15,,,,,,,VERY FAMILIAR with Measure 99,VERY FAMILIAR with the role OSU Extension plays,"The loss of your funding has really hurt us, and our ability to attend Outdoor School. Our district has not applied for the funds from Measure 99, and without your grant, we are scrambling to find ways to fund next year's trip.",,393,406,221,54.4%,185,45.6%,4,1%,13,3.2%,2,0.5%,4,1%,43,10.6%,317,78.1%,23,5.7%,59,56,67,80,69,75,,,,,,,,true,Spencer Butte Middle School – Eugene,-123.0848729,44.0053241,Spencer Butte Middle School,x
Edison Elementary School – Eugene,Edison Elementary School,Eugene SD 4J,Lane ESD,Theodore Roosevelt Middle School – Eugene,1328 E 22nd Ave,Eugene,OR,97403,Lane,541-790-8900,K,5,Elementary,Public,Regular School,510,Principal,Tom Horn,horn_t@4j.lane.edu,,,No,,,,,,,,,,,,,,,,,,,,,,366,380,202,53.2%,178,46.8%,1,0.3%,28,7.4%,,0%,9,2.4%,40,10.5%,282,74.2%,20,5.3%,59,66,63,55,70,67,,,,,,,,false,Theodore Roosevelt Middle School – Eugene,-123.0726392,44.0356168,Roosevelt Middle School,
Edward Byrom Elementary School – Tualatin,Edward Byrom Elementary School,Tigard-Tualatin SD 23J,Northwest Regional ESD,Hazelbrook Middle School – Tualatin,21800 SW 91st Ave,Tualatin,OR,97062,Washington,503-431-4300,K,5,Elementary,Public,Regular School,1142,Principal,Matt Coleman,mcoleman@ttsd.k12.or.us,,,Sister school did,,,,,,,,,,,,,,,,,,,,,,560,551,267,48.5%,284,51.5%,2,0.4%,14,2.5%,5,0.9%,9,1.6%,96,17.4%,393,71.3%,32,5.8%,91,86,101,96,91,86,,,,,,,,false,Hazelbrook Middle School – Tualatin,-122.7713417,45.3620927,Hazelbrook Middle School,
Edwards Elementary School – Newberg,Edwards Elementary School,Newberg SD 29J,Willamette ESD,"Mountain View Middle School – Newberg, Chehalem Valley Middle School – Newberg",715 E 8th,Newberg,OR,97132,Yamhill,503-554-5050,K,5,Elementary,Public,Regular School,1217,Principal,Scott Murphy,murphys@newberg.k12.or.us,,,Yes,50,5th grade,Coastal Discovery Center at Camp Gray,3,2,OMSI,"Yes, and it CONNECTS TO STATE STANDARDS",OMSI,"Program provider staff, Parent volunteers",,,,,,,,,,,,,494,521,261,50.1%,260,49.9%,4,0.8%,1,0.2%,3,0.6%,7,1.3%,211,40.5%,282,54.1%,13,2.5%,95,96,100,107,68,55,,,,,,,,false,"Chehalem Valley Middle School – Newberg, Mountain View Middle School – Newberg",-122.9695757,45.2938313,Mountain View Middle School,
Edy Ridge Elementary School – Sherwood,Edy Ridge Elementary School,Sherwood SD 88J,Northwest Regional ESD,Laurel Ridge Middle School – Sherwood,21472 SW Copper Terrace,Sherwood,OR,97140,Washington,503-825-5700,K,5,Elementary,Public,Regular School,4730,Principal,Amanda Hollenberg,ahollenberg@sherwood.k12.or.us,,,Sister school did,,,,,,,,,,,,,,,,,,,,,,539,552,292,52.9%,260,47.1%,,0%,18,3.3%,6,1.1%,7,1.3%,72,13%,415,75.2%,34,6.2%,75,81,95,88,115,98,,,,,,,,false,Laurel Ridge Middle School – Sherwood,-122.8638684,45.3640305,Laurel Ridge Middle School,
El Puente Elementary School – Milwaukie,El Puente Elementary School,North Clackamas SD 12,Clackamas ESD,Alder Creek Middle School – Milwaukie,11250 SE 27th Ave,Milwaukie,OR,97222,Clackamas,503-353-5480,K,5,Elementary,Public,Charter School,4005,Principal,Colleen Sackos,sackosc@nclack.k12.or.us,,,Sister school did,,,,,,,,,,,,,,,,,,,,,,228,253,129,51%,124,49%,,0%,2,0.8%,,0%,2,0.8%,165,65.2%,74,29.2%,10,4%,57,55,59,31,31,20,,,,,,,,false,Alder Creek Middle School – Milwaukie,-122.6339889,45.4417038,Alder Creek Middle School,
Elizabeth Page Elementary School – Springfield,Elizabeth Page Elementary School,Springfield SD 19,Lane ESD,"Briggs Middle School – Springfield, Hamlin Middle School – Springfield",1300 Hayden Bridge Rd,Springfield,OR,97477,Lane,541-744-6407,K,5,Elementary,Public,Regular School,546,Principal,Lacey Macdonald,lacey.macdonald@springfield.k12.or.us,,,No,,,,,,,,,,,,,,,,,,,,,,442,403,218,54.1%,185,45.9%,5,1.2%,2,0.5%,1,0.2%,6,1.5%,98,24.3%,260,64.5%,31,7.7%,60,62,68,70,70,73,,,,,,,,false,"Briggs Middle School – Springfield, Hamlin Middle School – Springfield",-123.0063084,44.0690642,Briggs Middle School,
Elk Meadow Elementary School – Bend,Elk Meadow Elementary School,Bend-La Pine Admin SD 1,High Desert ESD,Cascade Middle School – Bend,60880 Brookswood Blvd,Bend,OR,97702,Deschutes,541-355-1500,K,5,Elementary,Public,Regular School,1308,Principal,Kelle Hildebrandt,kelle.hildebrandt@bend.k12.or.us,,,Yes,90,5th grade,Camp Tamarack,3,2,Camp Tamarack,"Yes, and it CONNECTS TO STATE STANDARDS",We use curriculum developed by an outside provider,Program provider staff,,,,,,,,,,,,,,,,,257,46.5%,1,0.2%,4,0.7%,2,0.4%,4,0.7%,84,15.2%,442,79.9%,16,2.9%,89,89,84,111,96,84,,,,,,,,false,Cascade Middle School – Bend,-121.345295,44.014288,Cascade Middle School,
Elkton Charter School – Elkton,Elkton Charter School,Elkton SD 34,Douglas ESD,,739 River Rd,Elkton,OR,97436,Douglas,541-584-2228,K,12,Other,Public,Regular School,302,Principal,Mike Hughes,mike.hughes@elkton.k12.or.us,,,Yes,20,,Hancock Field Station,3,2,OMSI,"Yes, and it CONNECTS TO STATE STANDARDS",OMSI,,,,,,,,,,,,,,255,258,134,51.9%,124,48.1%,,0%,2,0.8%,1,0.4%,3,1.2%,18,7%,220,85.3%,14,5.4%,13,14,18,18,23,19,22,18,21,26,22,21,23,false,,-123.5702076,43.6380775,,
Elliott Prairie Christian School – Woodburn,Elliott Prairie Christian School,,,,5383 S Schneider Rd,Woodburn,OR,97071,Clackamas,503-634-2317,5,12,Other,Private,Regular School,,,,,,,,,,,,,,,,,,,,,,,,,,,,,,,,,,,,,,,,,,,,,,,,,,,,,,,,,,,,,,false,,-122.756019,45.135852,,
Elmira Elementary School – Elmira,Elmira Elementary School,Fern Ridge SD 28J,Lane ESD,Fern Ridge Middle School – Elmira,88960 Territorial Rd,Elmira,OR,97437,Lane,541-935-8214,K,5,Elementary,Public,Regular School,563,Principal,Michelle Marshall,mmarshall@fernridge.k12.or.us,,,Yes,50,5th grade,Kiwanis Sky Camp,4,3,Self,"Yes, and it CONNECTS TO STATE STANDARDS","School staff develop the curriculum, High School Counselors","High school mentors, Teachers",We are ABLE TO MAKE ALL NECESSARY accommodations so our program is accessible for all students,25,,,,,,,A BIT FAMILIAR with Measure 99,NOT AT ALL FAMILIAR with the role OSU Extension plays,We run a great program. It has been fine tuned over the years and runs well!,,253,250,127,50.8%,123,49.2%,8,3.2%,,0%,,0%,3,1.2%,15,6%,218,87.2%,6,2.4%,26,22,45,46,56,55,,,,,,,,false,Fern Ridge Middle School – Elmira,-123.354843,44.072242,Fern Ridge Middle School,
Elmonica Elementary School – Beaverton,Elmonica Elementary School,Beaverton SD 48J,Northwest Regional ESD,Five Oaks Middle School – Beaverton,16950 SW Lisa Ct,Beaverton,OR,97006,Washington,503-356-2080,K,5,Elementary,Public,Regular School,1162,Principal,Cynthia Lam-Moffett,cynthia_lam_moffett@beaverton.k12.or.us,,,No,,,,,,,,,,,,,,,,,,,,,,606,647,304,47%,343,53%,4,0.6%,223,34.5%,3,0.5%,13,2%,202,31.2%,169,26.1%,33,5.1%,133,128,111,104,88,83,,,,,,,,false,Five Oaks Middle School – Beaverton,-122.8515124,45.5156768,Five Oaks Middle School,
Elton Gregory Middle School – Redmond,Elton Gregory Middle School,Redmond SD 2J,High Desert ESD,"John Tuck Elementary School – Redmond, M A Lynch Elementary School – Redmond, Tom McCall Elementary School – Redmond",1220 NW Upas Ave,Redmond,OR,97756,Deschutes,541-526-6440,6,8,Middle,Public,Regular School,1326,Principal,Tracie Renwick,tracie.renwick@redmondschools.org,,,Sister school did,,,,,,,,,,,,,,,,,,,,,,581,632,329,52.1%,303,47.9%,10,1.6%,1,0.2%,2,0.3%,,0%,118,18.7%,472,74.7%,29,4.6%,,,,,,,211,210,211,,,,,false,"John Tuck Elementary School – Redmond, M A Lynch Elementary School – Redmond, Tom McCall Elementary School – Redmond",-121.1826475,44.303804,,
Emerald Christian Academy – Pleasant Hill,Emerald Christian Academy,,,,35582 Zephyr Way,Pleasant Hill,OR,97455,Lane,541-746-1708,PK,10,Other,Private,Regular School,,,,office@emeraldchristianacademy.org,,,,,,,,,,,,,,,,,,,,,,,,,,,,,,,,,,,,,,,,,,,,,,,,,,,,,,,,,,false,,-122.9486872,43.9793967,,
Emerson School – Portland,Emerson School,Portland SD 1J,Multnomah ESD,Da Vinci Middle School – Portland,105 NW Park Ave,Portland,OR,97209,Multnomah,503-525-6124,K,5,Elementary,Public,Charter School,3991,Principal,Sunita Sandoz,Sunita@emersonschool.org,,,Yes,19,5th grade,Jawbone Flats,3,2,Opal Creek Ancient Forest Center,"Yes, and it CONNECTS TO STATE STANDARDS",,Program provider staff,,,,,,,,,,,,,144,144,65,45.1%,79,54.9%,,0%,3,2.1%,,0%,8,5.6%,18,12.5%,70,48.6%,45,31.3%,23,25,24,25,27,20,,,,,,,,false,Da Vinci Middle School – Portland,-122.6794187,45.5239432,da Vinci Middle School,
Englewood Elementary School – Salem,Englewood Elementary School,Salem-Keizer SD 24J,Willamette ESD,Parrish Middle School – Salem,1132 19th St NE,Salem,OR,97301,Marion,503-399-3143,K,5,Elementary,Public,Regular School,736,Principal,Gary Etchemendy,etchemendy_gary@salkeiz.k12.or.us,,,No,,,,,,,,,,,,No,,,,A BIT interested,2018/2019 school year,SOMEWHAT FAMILIAR with Measure 99,A BIT FAMILIAR with the role OSU Extension plays,An overnight program will probably not work with my teachers,,359,367,190,51.8%,177,48.2%,9,2.5%,2,0.5%,4,1.1%,3,0.8%,100,27.2%,225,61.3%,24,6.5%,59,57,60,58,69,64,,,,,,,,false,Parrish Middle School – Salem,-123.0112254,44.9456944,Parrish Middle School,
Ensworth Elementary School – Bend,Ensworth Elementary School,Bend-La Pine Admin SD 1,High Desert ESD,Pilot Butte Middle School – Bend,2150 NE Daggett Ln,Bend,OR,97701,Deschutes,541-355-1600,K,5,Elementary,Public,Regular School,4129,Principal,Dana Pedersen,dana.pedersen@bend.k12.or.us,,,Yes,43,5th grade,Camp Tamarack,3,2,Camp Tamarack,"Yes, and it CONNECTS TO STATE STANDARDS",We use curriculum developed by an outside provider,Program provider staff,,,,,,,,,,,,,,,,51.8%,109,48.2%,2,0.9%,,0%,,0%,2,0.9%,40,17.7%,174,77%,8,3.5%,33,44,33,39,36,41,,,,,,,,false,Pilot Butte Middle School – Bend,-121.2754611,44.0720841,Pilot Butte Middle School,
Enterprise Elementary School – Enterprise,Enterprise Elementary School,Enterprise SD 21,Region 18 ESD,,201 SE 4th St,Enterprise,OR,97828,Wallowa,541-426-3812,K,6,Elementary,Public,Regular School,1090,Principal,Brad Royse,broyse@enterprise.k12.or.us,Note 9,,,,,,,,,,,,,,,,,,,,,,,,216,206,103,50%,103,50%,1,0.5%,2,1%,,0%,,0%,8,3.9%,186,90.3%,9,4.4%,31,22,29,28,30,35,31,,,,,,,false,,-117.272253,45.4248497,Enterprise High School,
Enterprise SDA School – Enterprise,Enterprise SDA School,,,,PO Box N,Enterprise,OR,97828,Wallowa,541-426-8339,K,9,Other,Private,Regular School,,,,http://enterprise24.adventistschoolconnect.org/article/15/contact-us,Note 9,,,,,,,,,,,,,,,,,,,,,,,,,,,,,,,,,,,,,,,,,,,,,,,,,,,,,,,,,false,,-117.2741441,45.7600276,,
Eola Hills Charter School – Amity,Eola Hills Charter School,Amity SD 4J,Willamette ESD,,9015 Community Club Rd,Amity,OR,97101,Yamhill,(503) 437-9138,K,12,Other,Public,Charter School,4505,Principal,Nicole Wollenweber,bcsnwollenweber@onlinenw.com,Left VM 8/7,,No,,,,,,,,,,,,,,,,,,,,,,38,47,31,66%,16,34%,1,2.1%,1,2.1%,,0%,1,2.1%,9,19.1%,30,63.8%,5,10.6%,,,,,,2,2,3,3,6,7,9,15,false,,-123.3198586,45.0648959,,
Errol Hassell Elementary School – Beaverton,Errol Hassell Elementary School,Beaverton SD 48J,Northwest Regional ESD,Mountain View Middle School – Beaverton,18100 SW Bany Rd,Beaverton,OR,97007,Washington,503-356-2090,K,5,Elementary,Public,Regular School,1161,Principal,Scarlet Valentine,scarlet_valentine@beaverton.k12.or.us,,,Sister school did,,,,,,,,,,,,,,,,,,,,,,502,466,238,51.1%,228,48.9%,,0%,37,7.9%,2,0.4%,11,2.4%,92,19.7%,272,58.4%,52,11.2%,82,80,76,73,85,70,,,,,,,,false,Mountain View Middle School – Beaverton,-122.863246,45.466584,Mountain View Middle School,
Estacada Middle School – Estacada,Estacada Middle School,Estacada SD 108,Clackamas ESD,"River Mill Elementary School – Estacada, Clackamas River Elementary School – Estacada",500 NE Main St,Estacada,OR,97023,Clackamas,503-630-8516 x2501,6,8,Middle,Public,Regular School,134,Principal,Kristin Turnquist,turnquistk@estacada.k12.or.us,,,Yes,131,,Camp Magruder,4,3,Northwest Regional ESD,"Yes, and it CONNECTS TO STATE STANDARDS",,,,,,,,,,,,,,,364,353,191,54.1%,162,45.9%,1,0.3%,4,1.1%,,0%,,0%,51,14.4%,285,80.7%,12,3.4%,,,,,,,124,106,123,,,,,true,"Clackamas River Elementary School – Estacada, River Mill Elementary School – Estacada",-122.3331292,45.2934064,,
Eugene Christian School – Eugene,Eugene Christian School,,,,2895 Chad Dr,Eugene,OR,97408,Lane,541-686-9145,PK,8,Other,Private,Regular School,,,,JMlynczyk@EugeneChristianSchool.com,,,Yes,32,"6th grade, 7th grade",Grove Christian Camp,4,3,None,"Yes, and it CONNECTS TO STATE STANDARDS",School staff develop the curriculum,"State agency or community resource experts (e.g. watershed council personnel or Fish & Wildlife staff), Parent volunteers, Professional from community",We are ABLE TO MAKE ALL NECESSARY accommodations so our program is accessible for all students,12,,,,,,,A BIT FAMILIAR with Measure 99,A BIT FAMILIAR with the role OSU Extension plays,,,,,,,,,,,,,,,,,,,,,,,,,,,,,,,,,,,,true,,-123.0613435,44.09056,,
Eugene Sudbury School – Eugene,Eugene Sudbury School,,,,2370 Parliament St,Eugene,OR,97405,Lane,541-683-5110,PK,12,Other,Private,Alternative School,,,,http://eugenesudburyschool.org/contact/,,,,,,,,,,,,,,,,,,,,,,,,,,,,,,,,,,,,,,,,,,,,,,,,,,,,,,,,,,false,,-123.1596574,44.0340856,,
Eugene Waldorf School – Eugene,Eugene Waldorf School,,,,1350 McLean Blvd,Eugene,OR,97405,Lane,541-683-6951,PK,8,Other,Private,Regular School,,,,https://www.eugenewaldorf.org/contact,,,No,,,,,,,,,,,,,,,,,,,,,,,,,,,,,,,,,,,,,,,,,,,,,,,,,,,,,,,false,,-123.113915,44.0246219,,
Evergreen Elementary School – Silverton,Evergreen Elementary School,Silver Falls SD 4J,Willamette ESD,,3727 Cascade Hwy NE,Silverton,OR,97381,Marion,503-873-4845,K,8,Elementary,Public,Regular School,718,Principal,Jamie Mccarty,mccarty_jamie@silverfalls.k12.or.us,,,No,,,,,,,,,,,,,,,,,,,,,,81,83,44,53%,39,47%,,0%,1,1.2%,,0%,,0%,1,1.2%,80,96.4%,1,1.2%,9,8,11,12,7,13,8,8,7,,,,,false,,-122.810532,44.980068,,
Ewing Young Elementary School – Newberg,Ewing Young Elementary School,Newberg SD 29J,Willamette ESD,Chehalem Valley Middle School – Newberg,17600 NE North Valley Rd,Newberg,OR,97132,Yamhill,503-554-4750,K,5,Elementary,Public,Regular School,1218,Principal,Kevin Milner,milnerk@newberg.k12.or.us,,,,,,,,,,,,,,,,,,,,,,,,,223,221,116,52.5%,105,47.5%,2,0.9%,1,0.5%,,0%,,0%,21,9.5%,190,86%,7,3.2%,20,46,31,47,42,35,,,,,,,,false,Chehalem Valley Middle School – Newberg,-123.0574188,45.3297737,Chehalem Valley Middle School,
Eyre Elementary School – Salem,Eyre Elementary School,Salem-Keizer SD 24J,Willamette ESD,Houck Middle School – Salem,4868 Buffalo Dr SE,Salem,OR,97301,Marion,503-399-3311,K,5,Elementary,Public,Regular School,751,Principal,Corina Valencia-Chavez,valencia-chavez_corina@salkeiz.k12.or.us,,,Yes,80,5th grade,Canyonview Camp,2,1,,,,,,,,,,,,,,,,,612,570,291,51.1%,279,48.9%,1,0.2%,5,0.9%,18,3.2%,10,1.8%,388,68.1%,142,24.9%,6,1.1%,75,102,96,114,91,92,,,,,,,,false,Houck Middle School – Salem,-122.961173,44.918195,Houck Middle School,
Fairfield Elementary School – Eugene,Fairfield Elementary School,Bethel SD 52,Lane ESD,Cascade Middle School – Eugene,3455 Royal Ave,Eugene,OR,97402,Lane,541-689-3751,K,5,Elementary,Public,Regular School,584,Principal,Jenny Sink,jenny.sink@bethel.k12.or.us,,,No,,,,,,,,,,,,,,,,,,,,,,360,364,178,48.9%,186,51.1%,2,0.5%,3,0.8%,,0%,,0%,110,30.2%,231,63.5%,18,4.9%,55,71,62,53,54,69,,,,,,,,false,Cascade Middle School – Eugene,-123.15055,44.07087,Cascade Middle School,
Fairview Elementary School – Fairview,Fairview Elementary School,Reynolds SD 7,Multnomah ESD,Reynolds Middle School – Fairview,225 Main St,Fairview,OR,97024,Multnomah,503-667-2954,K,5,Elementary,Public,Regular School,945,Principal,Jonathan Steinhoff,jsteinhoff@rsd7.net,,,Sister school did,,,,,,,,,,,,No,,,,VERY interested,2018/2019 school year,SOMEWHAT FAMILIAR with Measure 99,A BIT FAMILIAR with the role OSU Extension plays,,,395,388,206,53.1%,182,46.9%,5,1.3%,9,2.3%,4,1%,21,5.4%,169,43.6%,144,37.1%,36,9.3%,63,68,56,82,57,62,,,,,,,,false,Reynolds Middle School – Fairview,-122.4364333,45.5397647,Reynolds Middle School,
Faith Bible Christian School – Aloha,Faith Bible Christian School,,,,16860 SW Blanton St,Aloha,OR,97007,Washington,503-642-4112,PK,12,Other,Private,Regular School,,,,office@faithkids.org,,,Yes,23,5th grade,Camp Yamhill,4,3,,,,,,,,,,,,,,,,,,,,,,,,,,,,,,,,,,,,,,,,,,,,,,,,,,false,,-122.850319,45.4895721,,
Faith Christian School – Dallas,Faith Christian School,,,,2290 E Ellendale Ave,Dallas,OR,97338,Polk,503-623-6632,PK,8,Other,Private,Regular School,,,,fcschool@fceagles.com,,,Yes,20,5th grade,Camp Yamhill,4,3,,,,,,,,,,,,,,,,,,,,,,,,,,,,,,,,,,,,,,,,,,,,,,,,,,false,,-123.2743651,44.9290892,,
Falls City Elementary School – Falls City,Falls City Elementary School,Falls City SD 57,Willamette ESD,,177 Prospect Ave,Falls City,OR,97344,Polk,503-787-3521,K,8,Elementary,Public,Regular School,1005,Principal,Art Houghtaling,art.houghtaling@fallscityschools.org,,,Yes,8,6th grade,Camp Magruder,4,3,Northwest Regional ESD,"Yes, and it CONNECTS TO STATE STANDARDS",We use curriculum developed by an outside provider,Program provider staff,We are ABLE TO MAKE ALL NECESSARY accommodations so our program is accessible for all students,6,,,,,,,VERY FAMILIAR with Measure 99,VERY FAMILIAR with the role OSU Extension plays,,,120,115,56,48.7%,59,51.3%,,0%,,0%,,0%,,0%,10,8.7%,101,87.8%,4,3.5%,15,14,13,10,13,11,8,14,17,,,,,true,,-123.4319179,44.8676678,,
Family School – Eugene,Family School,Eugene SD 4J,Lane ESD,,1155 Crest Dr,Eugene,OR,97405,Lane,,K,5,Elementary,Public,Alternative School,1339,Principal,Jennifer Hebard,hebard_j@4j.lane.edu,,,Yes,50,"6th, 7th, 8th",Grove Christian Camp,3,2,,,,,,,,,,,,,,,,,142,134,74,55.2%,60,44.8%,1,0.7%,2,1.5%,1,0.7%,2,1.5%,13,9.7%,102,76.1%,13,9.7%,17,28,25,21,23,20,,,,,,,,false,,-123.111331,44.016318,,
Family Solutions – Grants Pass,Family Solutions,Grants Pass SD 7,Southern Oregon ESD,,322 NW 'F' St,Grants Pass,OR,97526,Josephine,541-476-4248,K,6,Elementary,Public,LTCT,1275,Director,Karin Hilger,khilger@solutionsor.org,,,NA,,,,,,,,,,,,,,,,,,,,,,9,12,10,83.3%,2,16.7%,,0%,1,8.3%,,0%,,0%,1,8.3%,10,83.3%,,0%,1,4,3,3,,,1,,,,,,,false,,-123.3297307,42.4413126,,
Farmington View Elementary School – Hillsboro,Farmington View Elementary School,Hillsboro SD 1J,Northwest Regional ESD,,8300 SW Hillsboro Highway,Hillsboro,OR,97123,Washington,503-844-1735,K,6,Elementary,Public,Regular School,1189,Principal,Nabil Zerizef,Zerizefn@hsd.k12.or.us,,,Yes,39,6th grade,Camp Magruder,3,2,Northwest Regional ESD,"Yes, and it CONNECTS TO STATE STANDARDS",,,,,,,,,,,,,,,299,309,167,54%,142,46%,3,1%,12,3.9%,,0%,8,2.6%,56,18.1%,212,68.6%,18,5.8%,41,51,46,49,40,42,40,,,,,,,true,,-122.991595,45.4599405,South Meadows Middle School,
Faubion Elementary School – Portland,Faubion Elementary School,Portland SD 1J,Multnomah ESD,,2231 N Flint,Portland,OR,97227,Multnomah,503-916-5686,PK,8,Elementary,Public,Regular School,847,Principal,Jennifer McCalley,jmccalley@pps.net,,,Yes,45,6th grade,"Camp Angelos, Camp Arrah Wanna",5,4,Multnomah County ESD,"Yes, and it CONNECTS TO STATE STANDARDS",Multnomah ESD,Program provider staff,We are ABLE TO MAKE SOME accommodations so our program is accessible for all students,6,,,,,,,SOMEWHAT FAMILIAR with Measure 99,SOMEWHAT FAMILIAR with the role OSU Extension plays,,,460,472,230,48.7%,242,51.3%,3,0.6%,20,4.2%,4,0.8%,125,26.5%,147,31.1%,132,28%,41,8.7%,64,49,67,53,57,44,53,48,37,,,,,true,,-122.669284,45.5392378,,
Faulconer-Chapman School – Sheridan,Faulconer-Chapman School,Sheridan SD 48J,Willamette ESD,,332 SW Cornwall St,Sheridan,OR,97378,Yamhill,541-261-6960,K,8,Other,Public,Regular School,1235,Principal,Dave Kline,dave.kline@sheridan.k12.or.us,,,Yes,53,6th grade,Camp Howard,3,2,Multnomah County ESD,"Yes, and it CONNECTS TO STATE STANDARDS",Multnomah ESD,Program provider staff,We are ABLE TO MAKE ALL NECESSARY accommodations so our program is accessible for all students,,,,,,,,,,,,559,521,284,54.5%,237,45.5%,24,4.6%,3,0.6%,2,0.4%,3,0.6%,76,14.6%,363,69.7%,50,9.6%,50,56,56,66,59,48,65,60,61,,,,,false,,-123.401357,45.0920108,,
Ferguson Elementary School – Klamath Falls,Ferguson Elementary School,Klamath County SD,Southern Oregon ESD,,2901 Homedale Road,Klamath Falls,OR,97603,Klamath,541-883-5036,,,Elementary,Public,Regular School,470,Principal,Jodi Beanland,fritzk@kcsd.k12.or.us,,,Yes,52,6th grade,Camp Westwind,4,3,Northwest Regional ESD,"Yes, and it CONNECTS TO STATE STANDARDS",Outdoor School Staff,"Program provider staff, High school mentors",We are ABLE TO MAKE SOME accommodations so our program is accessible for all students,5,,,,,,,A BIT FAMILIAR with Measure 99,NOT AT ALL FAMILIAR with the role OSU Extension plays,"I love that our students from Klamath Falls are able to experience the beach, for many, it is the first or second time ever.  I think it is very important to take students to a different environment than where they live to experience new things.  Outdoor School is also the most science that students get in their elementary years.  Funding is our biggest challenge.  We do fundraisers every year to help and we scholarship students.  We don't leave anyone behind because they can't afford it but it is hard because Ferguson is a high poverty school.  However, the experience these kids have is worth it.  I am very appreciative of the NW Regional Education Service District for letting us come.",,481,491,244,49.7%,247,50.3%,20,4.1%,2,0.4%,2,0.4%,5,1%,72,14.7%,355,72.3%,35,7.1%,80,74,78,79,58,58,64,,,,,,,true,,-121.7227414,42.2000852,Brixner Junior High School,x
Fern Ridge Middle School – Elmira,Fern Ridge Middle School,Fern Ridge SD 28J,Lane ESD,"Elmira Elementary School – Elmira, Veneta Elementary School – Veneta",88831 Territorial Rd,Elmira,OR,97437,Lane,541-935-8230,6,8,Middle,Public,Regular School,564,Principal,Peter Barsotti,pbarsotti@fernridge.k12.or.us,,,Sister school did,,,,,,,,,,,,,,,,,,,,,,331,313,173,55.3%,140,44.7%,8,2.6%,2,0.6%,,0%,2,0.6%,20,6.4%,273,87.2%,8,2.6%,,,,,,,106,109,98,,,,,false,"Elmira Elementary School – Elmira, Veneta Elementary School – Veneta",-123.353037,44.0688039,,
Fields Elementary School – Fields,Fields Elementary School,South Harney SD 33,Harney ESD,,23657 Fields-Denio Rd,Fields,OR,97710,Harney,541-495-2233,K,8,Elementary,Public,Regular School,357,Head Teacher,Stacey Moser,mosers@harneyesd.k12.or.us,Call after 3:20,,No,,,,,,,,,,,,,,,,,,,,,,11,12,6,50%,6,50%,,0%,,0%,,0%,,0%,2,16.7%,8,66.7%,2,16.7%,1,1,2,2,2,2,,2,,,,,,false,,-118.6705577,42.2629807,,
Findley Elementary School – Portland,Findley Elementary School,Beaverton SD 48J,Northwest Regional ESD,Stoller Middle School – Portland,4155 NW Saltzman Rd.,Portland,OR,97229,Washington,503-356-2100,K,5,Elementary,Public,Regular School,1370,Principal,Kathleen Skidmore Dee,kathleen_skidmore@beaverton.k12.or.us,,,Yes,165,5th grade,Cedar Ridge,3,2,Northwest Regional ESD,"Yes, and it CONNECTS TO STATE STANDARDS",,,,,,,,,,,,,,,827,778,385,49.5%,393,50.5%,1,0.1%,442,56.8%,,0%,6,0.8%,31,4%,248,31.9%,50,6.4%,90,115,122,142,146,163,,,,,,,,true,Stoller Middle School – Portland,-122.812033,45.549864,Stoller Middle School,
Fir Grove Elementary School – Beaverton,Fir Grove Elementary School,Beaverton SD 48J,Northwest Regional ESD,Highland Park Middle School – Beaverton,6300 SW Wilson Ave,Beaverton,OR,97008,Washington,503-356-2110,K,5,Elementary,Public,Regular School,1163,Principal,Erin Miles,erin_miles@beaverton.k12.or.us,,,Sister school did,,,,,,,,,,,,No,,,,NOT AT ALL interested,Not sure at this point,A BIT FAMILIAR with Measure 99,VERY FAMILIAR with the role OSU Extension plays,Beaverton School District sends 6th graders to ODS.,,501,468,254,54.3%,214,45.7%,2,0.4%,15,3.2%,13,2.8%,11,2.4%,138,29.5%,242,51.7%,47,10%,77,82,76,75,80,78,,,,,,,,false,Highland Park Middle School – Beaverton,-122.817369,45.473788,Highland Park Middle School,
Fir Grove Elementary School – Roseburg,Fir Grove Elementary School,Douglas County SD 4,Douglas ESD,Joseph Lane Middle School – Roseburg,1360 W Harvard Ave,Roseburg,OR,97470,Douglas,541-440-4085,K,5,Elementary,Public,Regular School,270,Principal,Lisa Dickover,ldickover@roseburg.k12.or.us,,,No,,,,,,,,,,,,,,,,,,,,,,282,313,167,53.4%,146,46.6%,2,0.6%,6,1.9%,1,0.3%,2,0.6%,51,16.3%,215,68.7%,36,11.5%,58,44,51,51,56,53,,,,,,,,false,Joseph Lane Middle School – Roseburg,-123.3652221,43.215513,Joseph Lane Middle School,
